Topic,Count,Name,Representation,Representative_Docs
40,19,40_reviews_windshield_use_radio,"['reviews', 'windshield', 'use', 'radio', 'alarms', 'attachment', 'review', 'alarm', 'suction', 'like']","['This AMAZONBASICS FM DUAL ALARM DIGITAL CLOCK RADIO (with USB Charging Port, LED Display) plays FM radio stations only. (It’s not a good choice for a news junkie like myself, as my favorite local news-only stations are all on AM channels.)<br /><br />The FM radio speaker sounds very tinny, so you won’t want to use the radio to listen to music. It’s okay, I think, for playing FM music to wake you up. If you don’t like the speaker, you can just use the plain alarm-sound option. You can also connect the clock to an auxiliary MP3 device.<br /><br />The beeper alarm doesn’t sound overly loud to me, even at the maximum volume. It takes many seconds for the volume to increase from the initial faint beep to the maximum. To wake out of a really sound sleep, you need a high-volume alarm.<br /><br />It’s nice being able to set two different alarms. The alarms are NOT tied to specific days of the week--you just turn on the one you want. One alarm is at the left of the clock, the other is at the right. Two people who rise at different times will like this feature, or one person can use it for something like weekdays and weekends.<br /><br />The digital display is large enough to read from across a room. However, the display is NOT so bright that it will interfere with sleeping. The time is easy to program by sliding the “Lock” button, holding down the volume button until the correct time is displayed, and sliding the Lock button back to locked position.<br /><br />Another nice feature is the battery backup. It takes two AAA batteries, and ensures that your alarm will go off on time even if you have a power outage while you’re sleeping.', ""First, I do NOT receive compensation of ANY kind for my reviews...I purchased this detector for my sedan. It is pretty large compared to my other detectors, but not terribly so. I have provided some pics with a ruler so you can consider. It came with an &#34;accessory&#34; kit... but honestly, it doesn't really need it as it comes with the cord and suction cup windshield attachment. It doesn't come with a lot of instructions, but it's pretty easy to figure out how settings work. I do find it nice to have a spare cord (in the accessory kit) - they don't last forever. The cord comes with an easily reachable &#34;mute&#34; button. Nice if your windshield is deep and therefore more inconvenient to reach. Although, I usually keep my detectors on &#34;auto mute&#34; so after a few beeps it stops.It has a phone jack connector (see pic) which is different for me - but doesn't seem to effect it's use. One of the nicest things I can say so far about this detector is that the screen is BRIGHT and inset. So it is VERY easy to read when it's silent. An important feature to me. It also came with a lovely case. I included a pic of the outside with measurements and an inside view of the case. The suction cup windshield attachment has a very easy to use &#34;release&#34; button so you can leave the suction cups just were they need to be, collect the detector, place in it's case and take it with you. In Arizona it gets super hot. So even though I have a carport, I take my detector inside or with me 99% of the time if I will be longer than 30 minutes. So far, it seems to do what a radar detector is meant to do, reminding me to take my foot off the gas pedal. It is also good to note that if you are hit with a laser, it's too late before you hear the alarm. I never hesitate to update my reviews if updated info would be helpful. And just a reminder, I do NOT receive compensation of ANY kind for my reviews."", 'Believe me when I tell you I read and read and read about these high-end RDs before making my choice. After reading the reviews on Amazon, I was very uncertain. But after looking at reviews by people in the tech biz, I decided to take the plunge and so far I am very glad I did.<br /><br />After very limited usage, this is what I have found (all I can do is speak for the unit I own):<br />1. the suction cups that came with the unit adhere to my windshield. The connection seems strong and tight. I left the cups on the windshield in 20-degree weather -- they have not budged. So far I see no need to buy a more deluxe suction device. I do remove the unit itself when I am out of the vehicle;<br /><br />2. the manual indicates that the RD is to be positioned flush against the windshield. So far I do not see a problem with that position. As I drive I have been keeping an eye on the unit. It remains steady, it shows no signs of movement on local streets (not the smoothest on God\'s earth, either);<br /><br />3. I was able to update the database of cameras by downloading the detector tools from the mfg. website. Since mine is a newer unit, I connected the unit via USB to a netbook, powered up the RD, clicked on the icons in the downloaded software, and was finished this process in about 15-20 mins. I did NOT have to do this download in my vehicle. The USB connection (netbook-to-RD) was all that was necessary; Note: until I turned the unit ON during the software update installation, the detector tools could not verify my serial number and the install would not proceed. (See my review of the AmazonBasics cable, which is the one you want for this RD.)<br /><br />4. so far the unit has functioned as described in the manual: it has very, very few false alarms, it stores detected points as I drive, I have it set on AUTO as recommended for the best hiway-city setting;<br /><br />5. compared to other detectors I have owned, which have all been in the $150 range, the Passport is by far the best at this early stage;<br /><br />I have yet to see how this baby behaves when I am on turnpikes and other places under surveillance by the good folks in blue. I am not a lead-foot particularly, I just love electronics; but there are times when the lull of the road will cause excessive speed. I like to be prepared.<br /><br />As I get more experience with this unit on the road, I will update this review. For now, I can honestly say this unit deserves the very high marks it has received on tech review websites. It looks and feels very well made.<br /><br />I am glad I made the move upward. I encourage you to do the same!<br /><br />First Update:<br />So far I have had no problems with the windshield suction cups adhering to the glass. The temperatures here have been between 20 and 50 degrees. From time to time I will press on the nubs to check the strength of the grip, and sometimes I will hear a ""clicking"" sound which ""resets"" the cups to full strength.<br /><br />I have been doing local driving only and there is very little ""chatter"" from the unit. I can only assume it is doing its job. It goes through the power up sequence just fine. I have not passed any stationary police vehicles. Another update will follow when I have somethinbg significant to report.<br /><br />Second Update: (April 21)<br />I finally had a chance to drive on the open road on a 4-hour round-trip. I can only assume that this detector is doing its job. True, I did not eyeball ANY police vehicles on my trip. The detector did not report any, either. So, is it working? As I say, I can only assume so. It did fire off several K-band alerts along the route, but nothing more.<br /><br />In my home area there are many speed cameras installed. My detector would have me believe than none are operative, since I have yet to receive a single camera alert. BTW, I am current on all updates via USB. I have nothing else to report, other than the fact that the unit powers up and self-tests as it should.<br /><br />Third Update May 14, 2013<br />For the first time since purchasing this detector it identified red light camera locations. I am now satisfied that this function is working properly.<br /><br />Fourth Update July 14, 2013<br />Even in extremely hot vehicle interior temperatures, the windshield suction cups have remained in place. As a matter of fact, the clip has not moved since I first attached it back in February.']"
41,19,41_priced_s70_handset_cost,"['priced', 's70', 'handset', 'cost', 'battery', 'charge', 'advertised', 'charges', 'camera', 'charged']","['This battery is more than twice the capacity of the original, so it takes a while to charge (12-24 hrs.) I am glad I bought a 3-pack, as they are not that easy to find. I am not sure yet if the increased capacity makes the charge last 2x longer. The last charge held about a week, so I have no complaints. It beats replacing the entire phone.<br /><br />UPDATE AFTER A FEW WEEKS OF USE<br />Even though the capacity of this battery is greater than the original, I find that a full charge does not last very long even with minimal use of the handset. I have the ringer OFF on the handset, too! So while I am a little disappointed in the battery performance, I will stick to my original statement and say it is better than replacing the entire phone.', ""For a lot of the battery powered items in our home, my husband prefers using rechargeable batteries. As wonderful as they are, they do seem to stop holding a charge after a few years of continuous use. These came at a great time when he needed to replace some of the old ones. First of all, we loved that these come precharged. I don't think that's the norm. I remember having to charge previous ones first. We did try them out in the our charger and they fit fine. Our living room remotes all have new batteries and are all working as expected. There has been no noticeable decrease in power over the last 10 days or so since changing them. I would definitely reorder these in the future."", 'I purposely held on to these for several weeks after I got them to see if they truly were fully charged and ready to go, as advertised. Indeed they were fully charged and I tried them in a lighted mirror and then in a flashlight. I use the flashlight quite often and so far the batteries seem to be holding up quite well. I have not yet needed to recharge them. They seem to be quality batteries and will save having to use disposable ones, which cost more in the long run. I may buy some more next time I need batteries.']"
42,19,42_help_trying_pointless_useful,"['help', 'trying', 'pointless', 'useful', 'sturdy', 'cheaper', 'great', 'pleased', 'perfectly', 'use']","['They are zip ties. Useful for everything.', ""These zip ties are a decent bargain and they work well. They are a perfect length for lots of uses. I used them to tie together a cord and it worked out great. I tried to undo it as a test and could not. I had to cut it and it wasn't easy to cut. Recommended if you need a lot of zip ties."", ""There's not a whole lot I can say about these. They're zip ties. They work as zip ties should. They are what I would expect from zip ties. This size is good for lots of household uses. I would reorder these.""]"
43,19,43_quality_durability_convenient_oem,"['quality', 'durability', 'convenient', 'oem', 'stores', 'advertised', 'very', 'everything', 'promised', 'smooth']","['Arrived as described', 'arrived promptly, packaged well and works like a charm. great seller!', ""The est'd delivery date was June 26th and it arrived on the 25th, which was 2 days after it was ordered. It all came packed as shown, though there was actually an additional carry case-ette forthe 3 neutral density filters which is not shown in the image . For the price, great deal. Delivery timing was amazing and communication with the seller is consistent and conscientious . .""]"
44,17,44_great_use_mp3_sound,"['great', 'use', 'mp3', 'sound', 'creative', 'e280', 'as', 'listening', 'adequate', 'recording']","[""I've owned this cassette player for years and decided to buy a second one and use them both in conjunction with one another. I have this wonderful French language course on tape...a little antiquated method of learning a language but, I have on good authority that this is a great course. I prefer to emerse myself in the language and then repeat what I hear outloud; therefore, I needed to have two cassette players to better critique myself. Further, I took one of the cassettes to work with me and used it in a lecture. I placed it inside my book bag during the lecture and the reception was great. It was a virtual lecture and I wasn't sure if the sound would be muffled but, to my surprise, I could hear every clear word. Most people today want all the newest gadgets and they pay an exorbitant amount of money for them; this item was so reasonably priced that it only sweetened the deal. It's one of my best purchases this year. I recommend this item!"", 'The product arrived very quickly, within 4 days. When I saw the box at the doorstep and went to pick it up. was shocked at how heavy the relatively small box was. Good sign! At least I knew it wasn\'t made out of \' Plastic from China\'. My previous Desktop 6 CD changer had long stopped working, as it would not \'read\' discs as was the case with the previous one . After reading multiple reviews of multiple \'Table Top"" multi-CD changers (all- in -ones) It seems that is a recurring theme.<br /><br />I have a few hundred CDs and already started Ripping them to hear on the phone via Bluetooth, but if I could just find a single CD player that would be reliable with Blue Tooth and perhaps even a slot for a USB stick (I could get into that too).<br /><br />This player seemed to be the ticket and it is. The user guide is very large with pictures, though the instructions are not \'the best\', but the player really is simple enough. If you can work one in a car, then this is no different.<br /><br />I connected the speakers which didn\'t take long, the ones from my previous player, and was up and running within 5 minutes. T . The sound quality is far better than my previous player which size wise was much larger.<br /><br /> . Actually, from the time I took it out of the box to the time I was listening to the first CD in it, was about 20 minutes (with the Blue tooth connected by then too). I shared some photos with a CD beside the player in this review so you can compare how big it is. The volume for my 2 bedroom condo is great, wouldn\'t need anything any louder, and it\'s clear sound (even with the likely very cheap speakers I have right now). So far, it\'s only Day 1 having it, but no complaints so far. Nicely, had just received an offer for Amazon Prime the same day, so have been using the blue tooth to take advantage of that. If you need a player that won\'t skip during an earthquake, this seems to be the one.<br /><br /> I tried playing a CD recorded using Windows Media Player, a variety of song copied down from YouTube put to CD, and the CD worked fine. Was also able to insert a USB stick with Music copied to it from the computer and with the help of the Very Rapid Response Customer Service was enabled to work through a \'glitch\' on my end in regard to how the player reads music stored on the USB device (which happens to be , \'a separate folder for each ripped CD\' )', ""This thing looks great but sounds and works poorly. I did a lot of research before purchasing and I thought this was the player to get (I wouldn't touch Apple, especially since radio is important to me). It had everything I wanted plus 8 gigs of (expandable) memory. But after learning how to use it, loading it up with music, pics and videos, and trying it for two days I sent it back. Pros and cons:<br /><br />PROS:<br /><br />- Great (expandable) capacity at a great price. Comparable Samsung and Creative products don't come close to holding this much music, video, etc. There's a reason after all why memory is the number one selling point for MP3 players.<br />- Good screen. Not as nice as the Samsung T9 (which is amazing), but still pretty nice. Video and photos look good as long as you're looking from straight ahead.<br />- Good tactile control. I really like the scroll wheel, which makes it easy to quickly cycle through menus and hundreds of songs. With the Creative Zen V Plus and the Samsung T9 you're at the mercy of the joystick or button.<br />- FM radio that's recordable. This is important to me. I passed on the Creative because it doesn't record radio. I wouldn't even consider an iPod because it has no radio at all (!!!).<br />- User-replacable battery.<br />- User interface is fast. That's important. A big strike against the Samsung is that it takes 3-4 seconds just to skip to the next song. When it comes right down to it, usability is key.<br /><br />CONS:<br /><br />- FM reception is bad. I live in a large city with lots of powerful FM stations that come in clear as day on every radio I've ever used. But not with this thing. Listening to FM is like listening to someone crumple a plastic bag.<br />- Recording functions are lame. The FM record level is so low that even at full playback volume it's hard to hear the recording while on the train(which is OK because it just records lots of static anyway). The voice recording lacks sensitivity.<br />- Scratches easily. I was as careful as I could be with my new toy, and my first day taking it out of the house it still got 4 or 5 small scratches on the front before I even got to work in the morning. Those little scratches are clearly visible and distort the light. I can only imagine what it would look like after a few months.<br />- User interface is just adequate. Wanna make a playlist on the fly? Good luck, because you have to play each song first in order to add it to the list. Wanna cue up the next song while listening to something else? Good luck, because I couldn't find any way to do that very basic function (if it's there it's not readily apparent). There are plenty of other quirks. All in all, it looks cool but isn't that easy to use.<br />- The four outside buttons are a pain. Control wheel is great. Buttons around the control wheel? Not so great.<br />- It's not large, but it is larger than its competitors. The Samsung T9 is 1/2 inch shorter and about 35% thinner. The Creative Zen V Plus is thicker but also much shorter. The iPod nano is of course much, much thinner and lighter.<br />- Volume is lacking. Even with MP3s that I know have high volume, the e280 can sometimes require turning up the volume very high to get the sound you want.<br />- Editing MP3 tag information does no good once your files are loaded onto the machine.<br /><br />So........overall I was disappointed and I thank Amazon for taking it back and refunding my money. The e280 is much better to talk about than to actually use. If FM and recording performance isn't important to you then you should add one star to this review.<br /><br />And here's a tip if you do buy the e280 -- make sure the ID tag info on your MP3s is in order BEFORE you load up the machine. Because changing the tag info once the machine is loaded up won't make the album, artist and song menus any better. Do it first.""]"
45,17,45_bluetooth_device_worked_ipod,"['bluetooth', 'device', 'worked', 'ipod', 'using', 'use', 'adapter', 'works', 'pair', 'great']","['i just got it but im impressed ""so far"" sounds good looks good easy to pair with my Google Mini home ... !<br /><br />i was impressed until last night when the yellow light turned on the blue light wont come back i dont have 2 to pair together dont need them and now the light wont go out even though i did what the book and manufacturer said im returning this cuz without the blue light it wont work ! i also noticed while it was playing yesterday for the short time it worked it skipped alot of times', ""Let me start by saying I got the Philip's Gogear as part of the Vine program. I have always used an Ipod, so this was new for me. I really had serious issues with using this device. First for the positives: it's an attractive size and the display is clear. On the downside, I found it difficult to navigate. I also experience, while running, the jostling of the settings (meaning that all of a sudden it skipped to the next song). I had a real problem with that, so I stopped using it. Figure I can give the device to a kid or someone who doesn't jog or require any kind of non-static device. So, I rated this two stars thinking that maybe someone who doesn't exercise and is simply listening to music might have a use for this, but I am returning to my Apple."", ""Great little gadget for bluetooth if your device does not have bluetooth capabilities. It's easy to use & install. Unfortunately, it did not work on my computer. I'm assuming it's because I have recently updated my computer to Windows 10. The product description lists older versions of Windows that it is compatible with. I did try it on my daughter's laptop because she is resisting the Windows update and still has the prior version. It worked well with her laptop and did what it was supposed to do. She was able to use bluetooth headphones to listen to music.<br /><br />I received this adapter from Anleng for the purpose of trying it out & reviewing. My thoughts & opinions are my own.""]"
46,17,46_batteries_charging_charger_charge,"['batteries', 'charging', 'charger', 'charge', 'garmin', 'light', 'charged', 'town', 'switch', 'charges']","['This is an inexpensive charger that does the job well. Be sure to read the directions carefully and follow them -- especially the requirement that you charge batteries in pairs. Apparently this device can distinguish between Ni-cad and NIMH batteries on its own (it has no switch to set for that distinction).', ""It's been a while since I've had a new wall charger for my phone. I used to have several spares, but over time they've either failed or gotten misplaced. I was going out of town recently and grabbed this to take with me. I like having extras for travel so I don't take my primary one and risk misplacing it. This works well and as expected. I didn't really notice whether or not it's fast or not. I have a new phone that has an amazing battery and seems to always finish charging really quickly."", ""At first, I thought I had a defective unit that would not charge. When charging, there is a light that comes on. That light stayed red for the entire time I was charging the unit. I thought it should change color when charged, but the manual says the light flashes while charging and then is steady when fully charged. That being the case, the unit probably charged much quicker than I thought. One confusing thing is that you have to hold the switch to turn it on for about 2 seconds before the unit comes on. Off is instant as soon as you touch the switch. Includes charging cord and 4 different nozzle tips for a variety of tasks. It has two different speeds, but the slower speed didn't seem like it had enough power to do much. The higher speed seemed sufficient for most tasks but didn't seem quite as strong as you would get from a can of compressed air. Also has a light on the front to light up your work, which is a nice feature. Comes with a storage bag, which seemed a little small, but does hold the item and the nozzles and the charger cord. The big advantage with this device is of course that you don't have to keep buying cans of compressed air.""]"
47,17,47_recommend_item_described_product,"['recommend', 'item', 'described', 'product', 'use', 'purchase', 'using', 'basement', 'looks', 'productit']","['I love this product!!!!', 'I love this product!', 'This product is great!']"
