Topic,Count,Name,Representation,Representative_Docs
-1,946,-1_reviews_these_ipad_quality,"['reviews', 'these', 'ipad', 'quality', 'cable', 'them', 'photos', 'phone', 'product', 'bought']","[""Pretty much a plug and play device; 1 minute to install. There is supposed to be a configuration program that you can access, but I wasn't able to do so with the IP address given in the instructions. It wasn't necessary anyway, as the device functions just fine on a simple network without any additional configuration. There are two things I didn't like about it compared to my old switch, that I was replacing. First of all, it is a bit larger than my old switch at 8 1/2 inches long compared to my old one that is only 6 1/2 inches. Also, the power supply is considerably larger at 6 inches long and 3 inches wide and 1 inch thick. My old switch uses only a large plug that is 1 3/4 x 1 3/4 x 1 1/4. The second thing I didn't like is that there are no indicator lights to show the functioning ports. My old switch has lights for each port that is working, which is nice. You may prefer not to have any lights and if so, this Linksys switch may be to your liking. Note: there is a disc included with documentation, but I didn't find it to be of any particular use. On the plus side, this does appear to be a quality, heavy duty switch, so might be well suited for a commercial application (such as in an unattended area, like a computer room in a large business). It appears to weigh nearly twice what my old switch did, so it is solid. I have used Linksys products before and found them to be good quality with no issues. You can buy a cheaper switch that is smaller and does essentially the same thing at a considerably lower price, but you most likely won't get the same quality as you would with this switch. Also this switch does apparently have a POE (power over internet) feature and if you need that, you also might want to get this. I don't see a need for POE in my configuration. Possibly overkill for typical home office, but if you want a good quality switch, it might be worth the extra cost (or not)."", 'If I could rate this 10 stars, I probably would... of course, time will be the true test! I had some really ugly black cable cords just sitting along the floor. Ugly to say the least. So, I thought I would try these. I just installed this along my base board (looks like quarter round) and it PERFECTLY holds and hides the cords. I have two cable lines and a very small, flat land line cord in it... plenty of room for another cable if necessary. There are no instructions.. but it\'s pretty easy. There is a clear film on the outside/front - the back is a the self stick. I was placing it on a painted, non textured wall - so it\'s very flat and the perfect material for this use. A couple of things I learned as I was placing it... it worked best for me to cord up the holder before sticking to the wall - IMPORTANT - the sticky back is SOLID - NO repositioning at all. You want to make sure you have shoved up against the last one you placed as tightly as possible - you will still see the seam between each length - but less so if you carefully, firmly place each piece. Before removing the sticky back I ""placed"" it in position to see if I liked it and it would work. Good thing, because once you remove the sticky back, it is NOT coming off without the sheet rock in torn pieces... just fyi. I chose to position the opening part of the D tube facing up to make it easier to put another cord in or take one out... personal choice. The ad says it is paintable and that is what I will try next. Having said that, I never hesitate to update my reviews should new info seem useful - and I am eager to see if this will stand the test of time and use.. meaning.. cords pulled, etc. I see no reason why you couldn\'t use this going up a wall (thinking of TV that has been hung on wall, etc - personal taste - but remember, the sticky tape is solid and won\'t be removed without tearing/damaging paint. As for textured surfaces - like wall texture, I am thinking that as positive as this sticky tape is, as long as it\'s not too textured, it should work - but to be honest, I have not tried it on a textured surface. As with most things that use a form of sticky tape, the smoother the surface, the better it will stick.) I hope this info was helpful to you!', ""I've had several sets of Bose Companion speakers over the years, but this was my first experience with a Bose Bluetooth product. Setup was quick and easy, and as you can use the speaker as the battery is charging for the first time (plugged in), I had my speaker powered up and connected within five minutes of unpacking. You can pair the SoundLink III with up to six devices and it will automatically connect to the last known device. With a 30-foot range, you can be several rooms away and still get crystal-clear sound.<br /><br />The sound quality is fantastic...good bass for a speaker this size. You can also REALLY crank up the volume on this one; sound is still full and balanced at max volume. I love that the unit is portable and holds a charge for quite a while (up to 14 hours; the battery lasts up to two years). Because the battery is not user-replaceable, I tend to keep it plugged in when I am using it for long periods.<br /><br />The one downside is the fact that there is no remote; it would be nice to at least be able to adjust the volume remotely rather than walking over to my phone and using the volume buttons, or walking over to the speaker and using the buttons on top, which are covered with a rubberized layer, but this is a small issue overall.""]"
0,184,0_headset_headphones_bluetooth_wireless,"['headset', 'headphones', 'bluetooth', 'wireless', 'earbuds', 'decent', 'phone', 'airpods', 'sound', 'ear']","[""I have not had any problems with these headphones. They actually fit in my ears. Some are too big, but these fit me nicely and the sound is nice. I've only been using them for a couple of days, but as of now, they are great!"", ""These are a great set of buds fore the price. I've tried dozens of ear buds over the years. How do these rate? I think for the price (Currently $43) they are an easy 5 stars. The sound is the best I've heard for the size of them and they are some of the smallest wireless buds I've tried. The noise cancelation (Which I'm not a big fan of because I use to work out and need to hear a bit of what going on around me) works well. They are a bit awkward to get out of the case bit it's not a big issue. Back tot he audio quality, the bass is someway lacking but for certain songs it actually works better than my AirPods especially if you seal them in your ears well. I can run in these fine without them falling out. Overall very pleased with these and the look pretty cool."", ""My husband has purchased Sennheiser headphones in the past and has been pleased with them. These live up to the Sennheiser name. They are lightweight, foldable over the ear headphones. They are great for travel or other situations where storage space is limited. They are adjustable to accommodate head size, but in a different way than most over the ear headphones I've tried. Instead of the actual headband part sliding apart to fit, the ear cups have about a two inch sliding range so you can move them up or down for the best fit. There will be less wear on the headband portion of the headphones for longer lasting results. The padding on the ear cups is about half an inch. The cups are comfortable to wear, even for extended time. Cups are labeled L/R, though it's black on black and a little difficult to see. The cable is a good length and seems to resist tangles so far. The sound quality has been excellent. I immediately noticed a difference between these and the inexpensive no-name headphones that I was using before these. I do not claim to be an audiophile, but for my entertainment purposes, I found the sound to be clear and crisp. There is no volume control other than on your device, though there is a small button so you can answer phone calls. A protective storage case would be nice.""]"
1,108,1_reviews_devices_useful_durable,"['reviews', 'devices', 'useful', 'durable', 'cords', 'very', 'great', 'ipad', 'iphone', 'these']","[""You can never have enough USB cables, especially this type with the mini end on it, as most devices these days use this size. What I especially like about this one is the length. It is nearly 10 feet long (3 meters), so what you are plugging in can be some distance from your computer. I also liked the fact that the cable is wrapped in braided nylon, so it seems very durable so it doesn't seem like it will kink up or easily wear out. It claims fast changing capability, but I am not sure that it charged my smartphone any faster than any other cable. The only downside that I can see at all is that this cable is rather pricey. The price is somewhat justified by the length and quality of the cable. If you want the best, buy this one and you aren't likely to need to replace it in a very long time, if ever."", 'This AMAZONBASICS USB-C 2.0 TO USB-C CABLE (3-Foot, White) has a USB-C connector (oval) on each end. You can plug the cable into any USB-C port, or you can use a USB-C adapter if you want to connect the cable to an electrical outlet.<br /><br />The cable works fine as a charging cable, but it lacks the fast data transfer speeds of USB-C 3.0, USB-C 3.1/gen1, or USB 3.1/gen2 cables. Try Googling for ""USB 3.0"" to learn more about the fast data transfer cables.<br /><br />In my experience, AmazonBasics products like this one perform well, are reliable, and are durable. The 3-ft. length is convenient for desktop use or for carrying in a purse or backpack. However, a longer cable is better if you will be plugging the cable into wall outlets.', 'I purchased these new cords along with an 8 port USB charging station. They are lightening fast charging. And they come with leather like material snap cord keepers. This keeps your cords nice and tidy with not in use or when you have extra length. They are about 3ft long as mentioned. I find the cloth covered cords seem to last longer being coiled and uncoiled - but that is my personal opinion. They are white with black dashes on the cord, as pictured. The tips are gold colored. So far, so good. However, I never hesitate to update my reviews should new info seem useful. And I hope this info was useful to you in some way.']"
2,105,2_quality_great_cloud_very,"['quality', 'great', 'cloud', 'very', 'security', 'camera', 'what', 'digital', 'used', 'br']","[""I got two outdoor security cameras of different brands at the same time. The other brand I could not get to work and setting it up was complicated and could apparently only be done through a cell phone. This camera, on the other hand, could be set up with a computer and the setup was easy and I had it working within minutes, for a live feed. The picture quality is good and I tested in the dark and still got a great picture. I didn't give it 5 stars because I couldn't get it to record (supposedly it has some built-in memory, although you can also add a memory card for more memory). For ease of setup and for the live feed, I give it 5 stars. I'll try to work with it some more and if I get all the features working, will update this review. Important note: I got this without giving thought to the fact that I didn't have a good place to mount it outside. Also, it needs an outlet to be plugged into, as do most security cameras. I have outside outlets, but nothing up near the roof where I would want to mount this. The power cord is not long enough to go for a very great distance, so might require an extension cord to run it. An exposed extension to a security camera is not very secure, as all anyone would need to do is unplug it to disable the camera. I thought perhaps I could just keep it inside and aim it out of a window. Unfortunately my windows sills are two narrow for the camera to sit and shoot out of a window. I didn't find a good way yet to mount in front of a windows. Of course my lack of planning is no fault of the camera. The camera seems rugged and well built. It appears to be able to use 5Ghz Wi-Fi; the other camera I tested did not. There is one slight design flaw; the aerial is very close to the mounting bracket, so it is difficult to position it properly."", ""So these are not bad cameras or great ones. They do seem to either miss important events or overcapture little ones like bugs flying past. My biggest issue is that I now own two outdoor cameras that would work if they could be charged. I use them with solar panels but after a few months I get a message that they need to be charged. I thought maybe this was because we had some not sunny days but now I am realizing that the port that the usb cord plugs into gets broken. I don't know if it is from wind or just cheap products but when I took each camera in to charge with the supplied cord from the box, the port sunk into the camera. There is no way to get them out. I tried to unscrew the camera to get it from the inside but the plastic seems to be welded on as even unscrewed I cannot open the camera. I contacted the company when it happened the first time and they said there was nothing they could do about it as the warranty expired. Then I asked them how to open it up so I could try to push it out and they said just undo the screws. When I told them that didn't work, they did not respond.<br /><br />For the second camera - it is a replacement they sent me from yet a different issue on the original. I have only had it up for 6 months and got the same message about needing it to charge. I brought it in from the solar panel and as I plugged the cord into it, the port pushed all the way in again. No way to access it. REally bad design flaw. I am waiting to hear back from the company but expect them to tell me it is out of warranty - even though it was a replacement given to me only 6 months ago, prior to the original camera's warranty expiration.<br /><br />The support seem nice. They only contact you through email so often takes 1-2 weeks to solve issues. At one point they did call me because my work schedule just did not allow for an accurate solution via email. The problem is the product has this major flaw when it comes to the quality of its ports for charging. Wish I could get a recommendation for a camera that has better built materials.<br /><br />So had to drop a star for this."", ""I just started using my camera yesterday and my first impression is that this thing seems very fragile. Hope I don't drop it, as it might not survive the fall. It is extremely small, light and compact. Think of two packs of cigarettes or two packs of playing cards. It is that small. Great for travel due to the light weight and compactness. Got it for about $90 on sale; would hate to pay more than that for it. Very easy to operate, but if you have big hands, this will be too small for you. Be warned that it won't take more than a couple minutes of video without a memory card, so you'll have to put a little more money into it if you really want to do video or really much of anything. The first video I took came out pretty decent, but it was in good light. I tried some still shots inside at night and they came out very dark in spite of the flash. The flash doesn't seem adequate, so this is probably a camera best used outdoors or in the daytime. Great camera for a kid. This is a good camera for small hands and a great size for kids. If they break it or lose it, you aren't out a bundle. As another reviewer pointed out, it does only take video in the ASF format; not MPEG, as the advertising suggests. I think MPEG might be just music files. I didn't need to install the software to capture the pictures or movies on my computer (Windows XP). Another great thing is that this is a complete package. It has the camera, a carrying strap, a carrying case, USB cable, TV cables, headphones, battery, battery charger and software. It does not come with a lens cap and the cap is not available either. You can buy an optional tripod for it and with the small size, I think that could be useful in some situations to help hold and stabilize the camera. I am not sure how you store music on it; I probably won't use that feature, but it seems like it would be a nice compact music player; again you'll need a memory card to save much of anything on it. One problem I had so far. The memory card (which you have to buy separately--a standard SD card) slips in the bottom under a little rubber membrane. The first time I held the camera I accidentally popped out the card and lost the shots I was trying to take. This might be a problem and I am thinking I may have to put a piece of heavy tape over the bottom to hold the membrane and memory chip in place and prevent ejecting the memory again. Another downside that I see is the battery. You can't just pick up some spare batteries at the corner store and pop them in. You have to use the special rechargeable battery. If you don't have a spare one charged up, your camera will go dead and you'll have to wait until you can plug in the charger and recharge the battery. That's another $20 for a spare battery. My digital camera uses standard AA batteries, so I can use either rechargeables or regular batteries. If this camera used regular batteries, it would make it larger and heavier, so the small rechargeable does help on the weight and size. Don't buy this if you are a serious photographer. Buy it for occasional use, for easy portability and as a first camera to learn on. Controls are easy and straightforward. Nice camera for the money, but not for serious photographers. It does a lot for a tiny little thing; sure doesn't make me want to go back to the days of huge video cameras that you had to hold on your shoulder, due to the weight. Minaturization can go too far and this is about as small as I would ever want to go; might be easier to use if it was just a tiny bit bigger.""]"
