Topic,Count,Name,Representation,Representative_Docs
23,30,23_kindle_just_size_tablet,"['kindle', 'just', 'size', 'tablet', 'ipad', 'paperback', 'so', 'about', 'very', 'book']","[""As a long time Kindle Fire user I was happy to see the new HD8. I waited until the price was unbelievable before purchasing because I didn't want to be disappointed. I loved the old Kindle Fire, the body, the features, all of it. I was extremely disappointed when Amazon did away with the indestructible design of the old Fire. My HD6 has been thrown, tossed, dropped more times than I can count (in a subway station, on concrete, on asphalt) and it just shuts itself off until you're ready to respect it. Turn it on and pick up right where you left off. I've had it for two years and I never planned on giving it up..until now.<br />I wanted the HD8 because I am a reader and being limited to how many books I can have at my fingertips is hurtful. I have over 3K books in the cloud and selfishly I wanted to keep about 1,000 on hand. New book, favorites, classics. Not having expandable memory affected that. With the HD8, I now have the capability to have my requisite 1000 books on hand at all times.<br />As a lover of all Amazon, I have a Fire TV. Last weekend my very sweet teenage children lost the remote and I was too in awe of their skill to search for it. I downloaded the app on my HD8 and it connected in under a minute. I know this app was always around, I've seen it but...on the tablet it's amazing. I have a blank screen and I just swipe using my finger to my hearts content.<br />Now to the technical stuff that I don't always get...the screen is crisp, very bright. The size is perfect and that was my initial concern. I didn't want a huge tablet but when I use the case I prop it on my tummy when I'm laying on the couch reading and it's perfect. Text to Speech is the best thing ever as of this minute. My books read to me...no need to pull up Audible as well!<br />I haven't seen any other major changes and I've been using a Fire HD for years, but I am in love with this one.<br />This will sound strange but my advice is get a case for it. Amazon sellers have a wide variety of cases and with the delicate feel of this tablet I am still a little wary of dropping it. Also, being able to prop it up makes it great for using it in the kitchen for your cookbooks, reading while laying down or watching movies in the bathroom (bubble bath-highly recommended).<br />As with my other Fire I take this one now with me EVERYWHERE I go. When I leave the house I grab cellphone, car keys and Kindle everytime. I highly recommend."", 'I received my Kindle Touch on November 23. I could not wait to fire it up, and I can say without fear of contradiction (smile) that this is one superb product. Even before I received mine, I had ordered another for my wife for Christmas -- I just had a feeling it would be a good idea. And now that I have actually experienced it, I am so glad I purchased two.<br /><br />What is there not to love about this wonderful device? The screen is clear, the text is easy to read, you can change the size of the font if you have ""old eyes"" like mine, I can and have downloaded e-books from my local library and by way of Amazon Prime (if you are not a member of Amazon Prime, get to it -- it is well worth the investment). The downloads were amazingly quick (using my wireless home network). I have to say the books appeared on my Kindle instantaneously.<br /><br />As soon as I received my Kindle, I charged the battery using a USB port. A full charge from out of the box took 90 minutes.<br /><br />I am so impressed with this product. Speaking as a college professor, I never thought I would want to own an e-reader. I have always loved the feel of books in my hands. However, there are so many stunning features to the Kindle Touch that I can recommend to anyone who may have such a reservation.<br /><br />My hat is off to Amazon.Com for making this item available. If at all humanly possible, buy one. If you want to make someone else very happy, give the gift of Kindle!', 'I received a Kindle 2 as a gift recently. I\'d had my eye on the Kindle since its launch, but couldn\'t justify the high price tag. I use several forms of portable technology including an HTC touchscreen smartphone, but the Kindle 2 was my first eBook reader. Opening the Kindle 2 was an experience: Amazon has cleverly packaged the Kindle in minimally wasteful packaging; the box itself is very clever and space-saving, and the USB cord is tucked into the two-prong adapter (so if, like me, you initially think that they forgot to include the USB cable, just pop the prong adapter off the end).<br /><br />First, the size: the Kindle 2 measures about 8 inches by 5 inches by .36 (it\'s literally thinner than a Number 2 pencil), so it\'s about the same size as a paperback without the thickness (or the weight). It weighs only 10.2 ounces, so it\'s easy to slide it into a large purse or backpack. The display is large and crystal clear, but is only in black and white, so if you\'re getting magazine or newspaper subscriptions, be aware. There are sixteen shades of grey, though, so photos and illustrations have a lot of depth and contrast despite being in black and white. There are six different text sizes available if you have problems with too-small fonts, but the Kindle screen isn\'t backlit, so this won\'t work in low light without a reading light. There\'s also the controversial text-to-speech feature, which is the same technology that\'s come with Windows OS for years; a synthesized voice (male or female) will ""read"" the text out loud (there\'s a 3.5mm headphone jack if you want to listen in private). After the Authors\' Guilld threatened to sue Amazon.com over the feature, publishers have the right to disable it on Kindle versions, so be aware that the text-to-speech feature may not work on all Kindle books.<br /><br />You can purchase and download Kindle books instantly using the Kindle 2\'s free Whispernet (an EVDO modem with fallback to 1xRTT that uses\'s Sprint\'s 3G network). Most New York Times Bestsellers are available in Kindle editions, which are typically $9.99. There are no Kindle rentals; once you\'ve downloaded the book, it\'s yours. However, there are numerous free Kindle books to be found on Amazon.com and elsewhere; simply click on the Kindle Books tab at Amazon.com and set to sort by price ($0.00 titles show up first). Many of the free Kindle texts are based on older (think 19th-century) authors and are transcribed by volunteers, so they may not be exactly what you were expecting. You can either purchase Kindle books from your PC and have them sent wirelessly to your Kindle, or you can browse and purchase directly from the Kindle, but be careful: Kindle books are purchased via 1-click, which means that you could accidentally purchase something you\'d only intended to look at. The download time depends on the size of the book; for a text-only book, it took less than a minute to download. When I downloaded a larger book with illustrations, it took several minutes.<br /><br />Reading on the Kindle is much like reading a paperback; the Kindle ""disappears"" as you read. However, the page turning is a bit jarring, since every time you turn a page, the screen flashes in contrast (at first I thought that it was some sort of flaw or bug). The previous page button is on the left edge, while there\'s a next page button on both sides of the Kindle, so page turning is easy (other than the screen flashing). On the downside, you can\'t flip several pages ahead easily without repeatedly clicking the ""next"" button. With a real paperback, you\'d simply thumb through the pages.<br /><br />There is no expandable memory slot, but the Kindle 2 features 2GB (1.4 GB for user content) of internal memory that will hold up to 1,500 books as well as documents (PDF, HTML, DOC, JPEG, GIF, PNG, BMP through conversion) and MP3 music and AAX Audible audiobook files. You can even set up customized MP3 music playlists (it\'s under ""experimental"") by dragging files into the ""Music"" folder on the Kindle by hooking it up to your PC via the included USB 2.0 cable. If you have documents that are in another format (the Kindle native format is .AZW), you have two choices for conversion: either e-mail the documents to your Kindle e-mail (your regular e-mail ended with @kindle.com) for a ten-cent conversion charge (you\'ll be billed when your conversion balance reaches $3.00) or to your email @free.kindle.com (you then must drag-and-drop the file onto your Kindle from your PC, but there\'s no fee to convert the file).<br /><br />The Kindle also features a basic Web browser that handles text-only versions fairly well, and a built-in dictionary. You\'re able to highlight, put in page markers and add notes to Kindle books, making it a useful tool for study or research. There\'s a full QWERTY keyboard and a five-way toggle that takes some getting used to. The menu designs are drop down similar to Windows; you simply move through the various options using the five-way controller, then press down on it to select.<br /><br />The battery can hold a charge for up to four days with the Whispernet on; you\'ll get a much longer charge if you turn it off. It takes about three hours to fully charge the battery, but it\'s not user-replaceable; you have to mail your Kindle to Amazon.com for a replacement. The battery is covered for the first year after purchase, but it\'s $59 after that. The Kindle 2 also doesn\'t come with [[ASIN:B001JAH7OM Amazon Kindle 2 Leather Cover]], for which you\'ll have to shell out extra money unless you choose to store it in the box.<br /><br />If you love new technology and are looking for new ways to read / listen on the go, the Kindle 2 may be a good choice for you. But besides the initial expense, the Kindle versions of paperbacks are as expensive as their paper counterparts. Depending on your area, the Whispernet may not have a strong signal (and for now, the Kindle 2 is only available in the US, so overseas customers will have to wait). I love mine, but it\'s up to you whether it\'s worth the cost of the Kindle 2 and book downloads.']"
24,30,24_use_electronics_screen_better,"['use', 'electronics', 'screen', 'better', 'zoom', 'product', 'does', 'lens', 'work', 'albums']","[""Try them. You will love them. Guaranteed.<br /><br />I've been using iCloths for several years now. They are the perfect phone screen cleaner, hands down!! I've tried other products from dry cloths, to alcohol rubs, to my t-shirt, nothing else comes close to clearning so thoroughly. One cloth is plenty!!<br /><br />They may see a little too dry to work when you are first using them. Don't worry. They are the perfect moistness.<br /><br />A trick. One side of the cloth is more rough than the other. Use the rough side to clear the phone screen. It works much better than the smoother side.<br /><br />I fold the cloth in half so there are two of these rough sides. I use one side to do the initial cleaning and the other side to do the final - perfection clean.<br /><br />Then, I fold the cloth inside out to clean off my finger tips before discarding the cloth.<br /><br />A suggestion - could you make a biodegradable wrapper?<br /><br />The price varies between 10 and 17 cents. Obviously, it's better when you get them for the lower price by buying a larger quantity."", ""I've been wearing reading glasses for years. But since I hated having to take them on/off all the time, I recently got prescription bifocals so I could leave them on all the time. I am shocked at how dirty they get! When the lenses have smudges and finger prints on them, it's really difficult to see through them and I have found it causes eye strain. I have a few microfiber cloths that have come free with purchase, but they are all boring gray or black colors and some of them are on smaller than I would prefer. The size of these cloths is perfect! Not too small or too big. I love the sweet, pastel colors too. I keep one in my purse, one in my desk at work, one in the living room next to my recliner and one on my night stand. They do a great job of cleaning the smudges off of my lenses and providing a clean view."", ""I am at that age where I can't read anything without my reading glasses. I have several pairs of glasses through out the house. And all of those glasses are covered in smudges & finger prints. Every once in a while I would use my shirt to wipe the smudges away and I know that's a big no-no. Now with 7 new microfiber cleaning cloths, I can have nice & clear lenses! I put one cloth in my purse, another in my sunglasses case, one in my kindle case, another one on my bedside table, and I still had some to share with my family. Somewhere I received a tiny cleaning cloth with something I purchased & it was too small for me. It was about 2 inches x 2 inches. I ended up throwing it away because it was too difficult to use. Plus that cloth left tiny flecks of lint on my glasses. These are a nicer, larger size which is perfect for cleaning my large trendy sunglass lenses. It leaves no lint and removes all smudges effortlessly.""]"
25,30,25_durable_worth_recommended_highly,"['durable', 'worth', 'recommended', 'highly', 'friendly', 'free', 'product', 'fantastic', 'manageable', 'described']","['Perfect fit to the phone.', ""I ordered this by mistake and when it arrived I was flabergasted. it is HUGE. I didn't send it back since it was my mistake. after a week of using it, no one could take it from me! it's fantastic. even my son is wanting one now. I highly recommend the seller."", 'Did not fit, returned']"
26,29,26_recommend_kindle_expensive_design,"['recommend', 'kindle', 'expensive', 'design', 'gift', 'beautiful', 'touch', 'covers', 'buttons', 'protects']","['The Verso ""Profile"" standing cover for Kindle Fire HD 8.9"" fits my Kindle snuggly, is attractive and works as designed in a standing mode (I actually watched a movie using the Kindle an this cover stand last weekend). It\'s attractive, but you can tell it\'s not leather (very vinyl looking and does have a vinyl smell to it). However, it is solid product and protects the Kindle well.I like the black since it goes with everything.', ""The bands are elastic, I much prefer the case that I purchased for my regular kindle vs this one. This one has elastic straps to hold in the paperwhite whereas the leather kindle holder for my other kindle allow the kindle to slip into it more securely and very snug fitting. The Snoopy Folio case has a snug fit but not as form fitted as the other one. I'm looking forward to amazon selling a case for the Kindle Paperwhite that is as secure as for the regular kindle.<br /><br />This one is expensive and will do in a crunch. I only recommend it because there isn't a better one out there yet."", ""Since I wanted to protect my investment in a Kindle Touch, I ordered this cover. I am glad I did. It fits my Kindle Touch perfectly. The four corner straps secure it to the cover, and there is an elastic strap at the lower end that fits around the entire case, making the Kindle impervious to attack by foreign objects in your bag, backpack, what-have-you.<br /><br />I agree with others who have said the cover is a bit pricey, but if you love your Kindle Touch as much as I love mine, you will want to protect it for many years to come with this sturdy jacket.<br /><br />When I purchased the cover, I wondered if the flip design would get in my way. Not to worry. I find myself so focused on what I am reading that I don't even think about it being there.<br /><br />Do not expect to stand the cover up with the Kindle in it. Despite the rubber strips on each end, the cover will slide. Not good.<br /><br />All things said, I recommend this cover. The first (and I hope last) time your Kindle slips out of your hand, you will be glad you have a modicum of protection if the cover is open, and a lot of protection when it is closed and secured.""]"
27,26,27_durability_quality_sound_hearing,"['durability', 'quality', 'sound', 'hearing', 'lasts', 'pricey', 'battery', 'purchase', 'phonebr', 'amp']","['got today it connected to my computer and it sounds amazing im ordering the 2nd one i loveeeeee it !! so small and amazing sound', 'amazing sound for the price', 'This is nice. Great sound.']"
28,25,28_quality_ipad_pro_sound,"['quality', 'ipad', 'pro', 'sound', 'use', 'videos', 'port', 'ipodtype', 'standard', 'nice']","[""My daughter has an older, iPhone 6. The headphone jack on her phone broke several months ago, so she has not been able to listen to music using headphones for a while. We got an estimate for repairing it, but she doesn't want to spend the money on it. I saw this and wondered if it would help solve that problem for her. Since it uses a lightening cable, we thought we would give it a try. It works wonderfully with her phone. She is very happy to be able to listen to music again without the use of a portable speaker. She is also able to charge her device at the same time. The sound quality is good and there has been no hissing or feedback."", 'This DAMFEYA APPLE CERTIFIED LIGHTNING TO 3.5MM HEADPHONE JACK ADAPTER DONGLE (for iPhone, iPad, iPod) really works! It eliminates the need to purchase Bluetooth earbuds/headphones for any late-model Apple product that has a lightning cable port but lacks an audio jack.<br /><br />To use the dongle, you plug it into your device’s lightning port, then plug your cabled earbuds/headphones into the dongle. Sound levels and playback are controlled by the Apple iOS.', 'Update: so, a little over a year later, this device does not hold a charge very long anymore. I’d be lucky if it lasts a couple of hours. I’m actually surprised it lasted this long but i’d say I got my moneys worth out of it! I use this product on my GL1500 Honda Goldwing. Since my iPhone 7 does not have a headphone jack, I bought this so I can plug my auxiliary cable out of my radio into this device and I am able to stream all of my stuff from my phone via the Bluetooth feature. I bought this particular brand because it was a little cheaper than the Griffin brand, but it is basically the same thing and so far the battery life seems pretty good for such a small device. It seems to last about 3 to 4 hours before needing a recharge. I use it for music and GPS.']"
29,25,29_usable_very_good_absolutely,"['usable', 'very', 'good', 'absolutely', 'about', 'used', '3g', 'work', 'what', 'really']","['This tablet is a great concept for having small tablets. I really enjoy the peace of mind that if the grandkids want to watch a movie on this, it has safe search settings for them to use. And if they are eating or drinking, more then likely they will be spilling something or leaving wonderfully adorable fingerprints all over this. So with it being water ‘resistent’, I am not to concerned about cleaning it afterwards. The battery life appears to be holding up quiet well. I have not used an android device very much but the “Ok Google” to start the voice activation is REALLY awesome!! Makes searching for recipes, music, videos, books or anything else online really convenient!!<br /><br />Once you sign into a google account, the device pretty much sets itself up without much hassle of having to create multiple new logins for different companies.<br /><br />The expandable memory slot is a really nice addition for adding a micro-SD, ive noticed they have dropped the prices on those so its very simple to make room or add media from a main computer.<br /><br />Cons: (so far)<br />A downside to this, because of the size, the screen resolution is a bit odd. And when looking at high resolution images, they still appear somewhat grainy.<br /><br />I think overall, for the price of this tablet, its an incredible deal, especially if you have kids that are starting to get on the internet, the kids safe option is a serious peace of mind at least for my family!', 'Listen, for the price, it\'s good. It\'s a reader, not really a tablet, but Amazon sort of marketed it to compete as a tablet. As a reader, it\'s exceptional. As a tablet it needs some work. Be prepared... there are glitches, app failures, files that cannot be loaded or used, no external volume control, once you put in in a ""cover/holder"" it is difficult to use the controls, you cannot delete files you have looked at without removing all and even though I SHOULD be able to access my paid Dishnet online account to play movies, I cannot on the fire because it will not accept a tiny video enhancement file. Further, I get a lot of ""connection error"" tabs when accessing the web or app store and more recently, it just freezes up. The only remedy at that point is to push and hold the power button.<br />I just heard they have a new version next Spring and they are supposedly working on software upgrades for the current release. It would be nice to have a camera so that you could Skype. On the ""up side""? I watched a free video (provided via ""Prime"" subscription. The video was flawless. Some ""apps"" are great and work well... about 1/2 do not.... I\'m a glass 1/2 full kinda gal, so I consider this on the ""up side."" Some have complained saying it is too easy to turn off the kindle fire... I don\'t find this to be an issue.<br />I\'ve updated my review to say that as a reader, the Fire rocks. As a tablet, you probably want something more reliable and solid.', 'I own a Amazon fire phone could not get apps from Google. Bike, jog, use a treadmill. I kept my previous Motorola smartphone used the apps for biking used Amazon fire phone for music from Spotifi. I use you tube visual walking and jogging videos. WELL, no I have this beautiful 10 inch pad. Can not accessible my Spotifi anymore for free. I really miss my German music. Can not access. Can not access even when I punch up Google, virtual youtube walking tapes, I love : Bejeweled 3 wanted to buy it, for this tablet, will not let me. I was stupid, 4 Persons told me, I would have no problems, getting my apps. I see some apps in Google, can not install them. Google has the best apps for fitness,jogging,biking,walking. What ever I put in to search, never comes up right. I getting all these games who come up. Can I get rid of them? Also apps are not on the open page: Bing, Microsoft, Google for easy access,everything has to be punched in. I had this tablet only five days, it frustrates me, that Amazon makes my decision. I purchased this for one reason,now I still use my Motorola now for the exercise apps. I will keep it. But if you individual exercise where you put your pad in your treadmill and jogging with beautiful surroundings. Forget it. I would love to have at least Bing handy to get to it fast. My neighbor now tells me I should have bought Samsung for what I wanted. I recommend this Amazon pad, to anyone who does not exercise,than I give it. 5Star, I love Amazon. (Excuse my English)']"
30,24,30_fit_ipod_purse_airpod,"['fit', 'ipod', 'purse', 'airpod', 'itjust', 'case', 'cases', 'clasp', 'will', 'leather']","[""I agree with most of the other reviews on here. The case is really quite nice, well made quality leather and fits the ipod snugly. Makes a beautiful, classy appearance to the eye. Only complaint is the fact that you have to remove the ipod from the case (which is not an easy task) every time you want to connect it to your computer. I haven't been as daring as everyone else in trying to 'doctor' up the case (by slicing through the leather) and don't think I will try it. I will use it as is."", 'Very sturdy and well made. My AirPods fit snugly into the case and the cases latching button is magnetic and closes easily and is very secure. The charging light is visible as there is an opening for it built into the case so you can see when it is light up red or green and the charging port is accessible so you don’t have to remove them to charge them. They clasp onto my purse sturdily and I have no worries about them becoming dislodged from my purse and getting lost. If you want to use a different clasp it’s interchangeable with one of your choosing of the same size. Great quality for a great price. HIGHLY RECOMMEND!!', 'We purchased this case for our new TI 84 Silver C graphing calculator, and we are glad we did. The case is very nice looking--not flashy, just a rich brown color. It seems durable and well made. The calculator is large, and the fit is very snug, but you really do not want your calculator shifting in its case, so this is fine. Just do not be discouraged if you find it hard to insert the calculator. You will be glad for the snug fit eventually. Highly recommended.']"
