Topic,Count,Name,Representation,Representative_Docs
10,45,10_quality_tape_very_great,"['quality', 'tape', 'very', 'great', 'fun', 'adhesive', 'notebooks', 'adhesion', 'media', 'adhere']","['My daughter is a college student. This year, she and her friends have started playing Among Us. These stickers are a fun assortment for those who play the game and are familiar with the characters. The quality of the stickers is good and comparable to other similar sticker packs. The images are colorful and clear.', ""I have ordered lots of stickers like these over the last few years. They are a lot of fun! These are good images. The actual stickers seem to be durable and nice. However, I had several stickers that were sticking to one another. I provided a couple of pictures. You can see that the backing paper is slightly askew from the sticker which causes some of the adhesive to be uncovered. That allows the stickers to stick to one another. Very annoying! There were probably at least a dozen or more of them like this. I went through every sticker to pul out any that weren't kid appropriate. My daughter is working at a summer camp and likes to give stickers to the kids. So I pull out any that may be religious or just not kid friendly. There were only a few that had to be pulled."", 'This is a fun assortment of stickers. The quality of the stickers is good. Images are printed well. They are sturdy, as far as stickers go. I would order again.']"
11,44,11_very_great_support_about,"['very', 'great', 'support', 'about', 'device', 'devices', 'good', 'work', 'dlink', 'you']","[""We live in a large two story house plus a basement. We were having to keep three separate Linksys WiFi routers (extenders) in our house, one on each floor prior to this. We were constantly having to switch networks in order to get any kind of signal as we moved around the house. Our teenagers were always getting frustrated with the drop outs. My husband was always having to tell them to switch WiFi routers. We've been using this router for about three weeks now and we have not had any trouble at all. We are keeping it located on the main floor in the living room. It easily reaches the bedrooms upstairs and the far corners of the basement. This can be used as a gateway or an extender. We are using it as an extender with our Comcast gateway to give us the WiFi throughout the house. If you don't have a gateway, It can be both a gateway and provide the WiFi too if you need it. Our Comcast gateway does not have WiFi. The strength of the signal has been full. It is amazing how much better this is performing. Our daughter has not complained once about not having any WiFi signal. It is larger than our previous routers. We have it positioned behind the TV in the living room on the entertainment stand. The speed has been great. We use anywhere from 7 devices to 12 at any one time. And if the kids have friends over, that number is more. My husband is a programmer and works at home a few days a week. He has been especially pleased with this new router. It has not interfered with his work. The antenna in the picture shows them pointing straight up, but it works much better if they are each at a 45 degree angle as mentioned in the manual."", ""For performance, I would rate this a solid 5-stars. I bought a quality $300 router before this one and it just wouldn't fully cover the house with adequate wi-fi strength. I spent $100 more on an extender, which finally helped somewhat, but still not ideal. The router in this D-Link system has good strong wi-fi signal by itself, but it includes an extender which make it even better. Excellent wi-fi coverage and also works good for wired connections as well. For the price, the D-Link router is well worth the money. So why not 5 stars in my rating? The setup instructions turned out to be useless for me, but may have been because my internet was coming in through a router/modem combo; multiple routers on a network can cause issues and change how you might access a given router to set it up. Support is important, especially when you are trying to set up for the first time, but I tried to call and there was a 25 minute wait, so decided to e-mail instead. That was several days ago and the e-mail has not been answered yet, so I am disappointed in support, so that's one reason I knocked one star off my rating. I strongly recommend you download the manual from their website, as the unit doesn't come with it. The manual seems to be well written and comprehensive. It still didn't help me with setup; I had to figure that out on my own. If you have a straight-forward setup that is not complicated, you may not have any issues with setting up this unit. Since this and most routers I have seen only have connections for 4 wired items, I am running an &#34;extension&#34; switch for more network devices and computer. I could not get it to work at first, until a network expert told me that you have to reboot the router after you connect the switch, in order for it to be recognized."", 'This is a good price for a starter kit of 5 devices. The program you install on your Smartphone is easy to install and looks like it works as intended. Here\'s the problem I encountered. Every time I tried to connect to my router I would get the message ""Only supported on 2.4 GHZ Wifi Networks"". My router is dual band and I believe it broadcasts WiFi both in 2.4 and 5 GHZ. Apparently these devices are not seeing the 2.4 GHZ and are looking at 5 GHZ and aren\'t able to connect or the Smartphone is connecting at 5Ghz and the device won\'t pair with the phone unless it is connected via 2.4Ghz. I contacted support and they gave me this answer: ""You will need to connect your mobile device to the 2.4Ghz Wifi for the app to connect to the devices when they are in the pairing modes. If you are unsure how to connect to the 2.4Ghz of the dual band router, you may need to log into the router to either turn on the 2.4Ghz WiFi or rename it so you know which connection is the 2.4Ghz. If you are unsure how to do so, you will need to contact your router manufacturer for assistance. Alternatively you can pair the devices via AP mode as indicated in the manuals of the devices."" I don\'t know how to make the necessary changes in my router to be able pair the smartphone with the 2.4Ghz connection and I didn\'t want to take the time to learn how and potentially mess up my router and/or the way the Smartphone connects to my router. (It seems like I would need to change both.) I tried the AP Mode that support mentioned, but it still would not connect; it would fail every time. The whole setup seems just too complicated. Also, they fail to tell you that at least on the water sensor, you have to twist open the device and remove the paper tab that prevents the battery from making contact, before you can set it up. Am disappointed and surprised that no other reviewers had the 2.4 vs. 5 Ghz issue. Not recommended unless you know all about how to set up your smartphone and router to connect at 2.4Ghz or unless they already are.']"
12,40,12_tablet_notebook_monitors_ipad,"['tablet', 'notebook', 'monitors', 'ipad', 'adjustable', 'very', 'phone', 'works', 'pretty', 'adjust']","[""We have a semi tiny house... and this table is actually better than you would think. It folds flat with all the accessories, including legs completely flat and compact. Everything has a place under the table, securely held until you set it up again. You don't have to put the cup holder or phone holder on if you don't want to. The top is black and the legs are a silver tone metal - just a pictured. The table portion slides to expand... or stays small and useful. The cup hold is rather small... and the phone holder has a foam insert to hold most phones expect the extra wide ones. I will say that the phone holder is a bit shallow... but it holds my samsung g7. The legs are adjustable to a wide range heights. Honestly, for the price it's a really awesome deal. Not SUPER solid - as you can imagine you won't be able to stand on them... but for a laptop or to pay the bills.. read a book with free hands.. play on your tablet.. it's plenty good. Especially if you have limited space! We bought two and in my personal opinion they are worth the price, or a bit more. They arrived quickly (we have prime) and in great condition along with other items I ordered. I feel comfortable recommending them, and I always update my reviews should new info seem useful."", 'Works well and is easy to set up. Very light and compact. You do need a flat surface to put it on, because if you try to use it on your lap, it folds up on you. Not sure how much I will really use it, as I am so used to an ergonomic (curved) keyboard that it is difficult to type on a flat keyboard and this is flat. It is full sized and if you have a lot of typing to do on your phone, this will be very helpful. Charging cord is a little short. The bonus phone stand that is included is nice, but my phone case is too thick, so it would not fit in the stand.', 'This RYYMX LAPTOP/NOTEBOOK STAND (360-Rotating; Compatible with 10 to 17 inch Notebooks) seems kind of expensive (about $30 on Amazon) for what it is. It consists of two metal sheets connected by a short metal post (all with a silvery matte finish).<br /><br />The top sheet has a short raised edge and thin rubber grippers that hold your notebook in place; you can rotate the top sheet and notebook in a complete circle to get your ideal viewing position. (The post rotates on a central bolt, not on ball bearings.) The stand height and viewing angle are NOT adjustable. The bottom sheet has thin rubber grippers that keep the stand from slipping around on whatever surface it’s resting on.<br /><br />None of this is very secure--the stand is only 10.2” wide, so it’s possible to dislodge a larger notebook if you bang into it with an elbow. The stand doesn’t have an especially small footprint, because of the post in the center. (A stand that is designed more like a shelf has space for papers beneath the stand.)<br /><br />The stand is fairly easy to assemble. You need to connect the post to the top and bottom sheets with eight short, small screws. The necessary screwdrivers are included.<br /><br />Stand Rotates 360 Degrees, Is Simple to Assemble']"
13,39,13_gift_setup_music_device,"['gift', 'setup', 'music', 'device', 'speaker', 'trackr', 'work', 'its', 'plug', 'clock']","[""Well, I have kind of given up on setting this up. First, I must admit I am a 50 something technically challenged woman (often times), so maybe it was just me. I easily was able to download the apps and get it to work with my IPhone. It was cool asking Siri to turn it on and off. I really wanted this for Echo and Alexa. Try as I might, I couldn't do it. I downloaded Wink and synced Alexa with Wink. And then synced IHome with Wink. Could not get Alexa to find the smart plug at all (and I spent hours today on and off trying to do this). I will try again tomorrow. However, I will tell you nothing is easy with this. I found no instructions for use with Alexa in the package and had to surf the web for solutions. Seems like a lot of work to be able to simply turn on a light with my phone. Also, I could not get Siri to do this remotely (while I was out and about), so I assume it only works if you are in the proximate area for programming. Seems expensive for what it really gives me."", ""The ECHO FLEX is perfect for my powder room. It plugs directly into an electrical outlet above the vanity sink, and it doesn’t require either (1) a cord, or (2) an accessory shelf to hold it out of the way (above the vanity countertop). Thus it reduces clutter around the sink; and it is safer than a regular Echo or Echo Dot in this location. (You can’t accidentally knock it into a sinkful of water.)<br /><br />The Echo Flex connects through the Alexa app, and does everything that the other Echo devices do. For my household, this means turning lights or tv on and off; setting timers and reminders; asking for local weather or traffic information; checking the time; asking general knowledge questions; doing math and recipe calculations; playing music; and “dropping in” on Echo devices in other rooms (using the Echos as an intercom). The speaker isn't up to audiophile standards for playing music, but it's fine for playing casual background music and for hearing the spoken word.<br /><br />The Echo Flex is especially great for my husband, who is hard of hearing. When he’s in the powder room now, he can hear me when I “drop in” even if the water is running. The Echo Flex is located only about a yard away. (He can’t hear me when I “drop in” to a bedroom device that is located about 15 feet away.)<br /><br />Setup takes about 5 minutes if you have already downloaded the Alexa app. After you plug the Echo Flex in, it advises you to open the Alexa app to complete the setup. The app takes you the rest of the way through setup."", ""UPDATE (2/21/19): So far, my clock is working well. I did buy a second clock, and succeeded in pairing it with my 1st Gen Echo Show. If you make a pairing mistake, you can press the clock's pairing button 5 times to unpair the clock and start over. Oddly, when the Show was correctly paired, the light turned solid orange. The Echo Show is hard to pair because it isn't completely integrated with the Alexa app when it comes to setting up a wall clock. However, for me, having two clocks, with visual timer displays paired to different Echo devices, was worth all the Setup hassles.<br /><br />This ECHO WALL CLOCK does two things that I really want. First, it keeps accurate time by using an Internet connection (through an Echo device) instead of a radio signal (which can malfunction in bad weather or at Daylight Savings Time changes). Second, it gives a bright visual display of the time remaining on all the timers currently set with my first-generation Echo. (Yes, it simultaneously displays the time left on multiple timers.)<br /><br />If my clock continues to work without requiring frequent Bluetooth re-pairing (as other reviewers have reported), I will order a second clock to pair with my Echo Show. The visual time-left display is very useful when I’m timing exercises or post-exercise ice treatments.<br /><br />The instructions warn you NOT to try to move the clock hands. (Other reviewers warn that touching the hands will break the clock, or cause it to tell slightly inaccurate time forever if you succeed in replacing the hands.) It’s too bad that the clock does NOT have a plastic cover over the face--dusting it is going to be a problem. I put mine on a wall, to protect it as much as possible from dust, and from accidentally being knocked over.<br /><br />SETUP PROBLEMS: Out of the box, the clock paired effortlessly with my Echo Show (using the option of asking the Show to set up the clock). However, I ran into a lot of difficulty when I tried to pair it with a second device (a first-generation Echo). The instructions do NOT make it clear that the clock PAIRS WITH ONLY ONE ECHO DEVICE.<br /><br />Probably because I failed to start the second Setup attempt by using the Alexa app to un-pair the clock from the Show, the second attempt failed. It ended with a green light that has no defined meaning in the paper or online setup instructions. Worse, the clock no longer worked with the Show. Still worse, the clock did NOT appear as a device in the Alexa app; and the app did NOT display the clock as a Connected or Bluetooth device under the Show settings.<br /><br />Eventually I found the clock under the settings for the Echo (subject of my second, failed Setup attempt). I was able to unpair it, delete it, and start Setup again. At long last, the clock paired with the Echo, and began working again (with the first-generation Echo).<br /><br />However, I failed in all attempts to use the Show to set up the clock again. Those attempts always concluded with a red error light or with that mysterious green light. At some point, I had to remove the batteries and replace them so that the pairing button on the clock would work. Naturally I now dread having to pair the clock again with any Echo device, should the Bluetooth connection malfunction.<br /><br />SUMMARY: The concept of the Wall Clock is great. I love my clock now, and really do intend to buy a second one, if the clock that I now have continues to work normally. However, I hope that later generations of the Echo Wall Clock will have a covered clock face, and that later versions of the Setup software will have much better integration with the Alexa app.""]"
14,38,14_transmitter_logitech_very_nice,"['transmitter', 'logitech', 'very', 'nice', 'keypad', 'wireless', 'need', 'keyboards', 'great', 'keyboard']","[""Have used this keyboard for many years at work and home and I wouldn't use any other keyboard. It is that comfortable. I would hate to pay the price they are asking for these now. Hate to say this for those of you who want one, but I just bought one for $2.99 from Goodwill. It is well worth it to have a spare on hand; actually have 2 spares, as obviously these are expensive to replace if you buy new. These keyboards have both USB and PS/2 type connectors and two USB ports in the back of the keyboard which I have never used. I tried out the USB ports in the back and they do not work. There could be a couple of reasons for this. One might be that in order for them to function, you might have to use the USB connector for the keyboard, rather than the round PS/2 connector. Another reason is that my keyboard does not connect directly to the computer, but goes through a KVM switch. Through the switch, the keyboard may not receive enough power to power the USB ports. I don't have a USB connector on my KVM switch, so I have to use the PS/2 round connector. The only problem that I have encountered with this keyboard is the feet that elevate the back of the keyboard to a comfortable angle, tend to fall off. I have lost a couple and cannot find replacements. If you are used to a flat keyboard, the tilted ergo keyboard does take some getting used to, but once you have used it for a while, you will never go back to a flat keyboard again. Microsoft has some newer versions of this keyboard, but I don't think they are an improvement and they are expensive."", ""Review update:<br />After using the keyboard for a little while, some of the keys stopped functioning and rolling up or bending the keyboard for storage or moving it, permanently damaged the product. There's no point to a flexible keyboard if it breaks because you bent it slightly. Not a very useful product beyond the novelty. Wouldn't recommend it unless you've been dying to have a quirky unresponsive keyboard you can take with you.<br /><br />------------<br />When I set to order a flexible keyboard, I mainly wanted it for the novelty. That is probably for the best since this keyboard is very unique. It lights up, is bendable and has nice texture to it. However, the keys are a little unresponsive unless you press them from a certain angle. Also the keyboard is a little larger than normal keyboards because of the extra inch and a half of covered wires at the end.<br /> If you are looking for a keyboard which is for gaming or for typing very fast, this is not the keyboard for you. If you want something cool and easy to pack or move, then you will likely love it."", ""This is advertised as an ergonomic keyboard. To me, ergonomic is a keyboard that is split into two slanted halves, like the Microsoft Natural Keyboard. This is a flat keyboard. In spite of that, the keys have a good feel and response. I only have wired keyboards, so I got this so that I could have a wireless if I wanted to use one sometimes, as you are then not confined with a cord. Requires 1 AA battery to operate (not included). At first, I thought they forgot to include the wireless transmitter, but it comes hidden in the battery compartment. This is okay, but there is no place to store it once the battery is installed. Of course, if you are going to store the keyboard and not use it all the time, you wouldn't typically want to leave the battery in anyway. If you want wireless, probably better to get a wireless mouse and keyboard together, as they would probably run off one transmitter, whereas with this keyboard if I want to add a wireless mouse later, it will involve using a second transmitter which would use another USB port. The keyboard is going to be of limited use to me, as I currently use a KVM-switch that allows me to control up to 4 computers with one monitor, one mouse and one keyboard. I would have to upgrade to a KVM switch that takes USB to use the keyboard on more than one computer. This is truly plug and play and I had it operating in no time at all. Seems like it is quality made and should last a while. Made in China of course.""]"
15,38,15_samsung_keyboard_sony_dvd,"['samsung', 'keyboard', 'sony', 'dvd', 'remotes', 'tvs', 'buying', 'wireless', 'replace', 'batteries']","['How can someone create a remote specifically for Apple TV and not have a home button? Completely defeats the purpose of getting a replacement remote if I still need to keep the original remote near by for when I need to use the home button.', 'This GE BACKLIT UNIVERSAL REMOTE CONTROL (Backlit, 8-Device, Graphite, 47510) has terrific bright backlighting, and works with my Samsung TV, but has too many buttons! It’s complicated to use, because most of the buttons (e.g., navigation, channel, volume, mute, menu, etc.) work only in conjunction with specific device and procedure buttons (e.g., TV, DVD, Stream, etc.).<br /><br />With my other remotes, you simply select the Input (Source), and all of the buttons will work to control the display, channels, etc. With the GE remote, you have to press a device/procedure button (e.g., TV, Stream) IN ADDITION TO selecting the Input/Source, or else the control buttons on the remote will NOT work properly.<br /><br />The GE remote works so differently from my other remotes, it’s a chore to learn how to use it. I love the brightly lit display, but that’s not enough to make me want to fiddle with extra buttons all the time.', ""This AMAZON BASICS WIRELESS KEYBOARD (with Touchpad for Smart TV - US Layout (QWERTY)) has the easiest setup I’ve ever encountered for a wireless device. You insert 2 AAA batteries (included) into the keyboard, plug the USB radio receiver into a USB port on your Smart TV, and you’re instantly connected. If for some reason you aren’t automatically connected, you just hit Esc-K to connect.<br /><br />The keyboard works with my Samsung QLED Q7F Smart TV. Not all of the function keys work with every screen--for example, the keyboard’s “Mute” button does NOT mute the TV--but that’s normal for generic controllers like this one that are intended to work with many different wireless devices.<br /><br />The keyboard does everything that my Samsung remote does (for example, switches between apps, sources, calls up the TV settings menu), although it takes a bit of experimentation to learn how to use it. The direction keys near the touchscreen allow you to navigate the TV screen and everything else. If you go to the TV’s Internet area, the touchscreen activates and you see a big arrow cursor that works like a mouse.<br /><br />The keyboard does the one thing that I really wanted. It has a Search button that allows me to search for TV shows, movies, etc. by typing on the keyboard, instead of by navigating around letter-by-letter on an onscreen letterpad. The keyboard does NOT work when I’m using Roku for searches, but that’s normal because the keyboard is designed to connect directly to a Smart TV (not to the TV’s connected accessories).<br /><br />The keyboard does feel cheap, and I wouldn't want to use it as a computer keyboard. However, it's fine for my occasional use as a Smart TV keyboard.<br /><br />NOTE: The wireless adapter is stored at the upper left of the box, inside the folded cardboard. The batteries are on the right.""]"
